{
  "hasFeatureOfInterest": {
    "id": "http://something.org/1"
  },
  "observedProperty": "something",
  "resultTime": "2016-05-04T02:27:02.0Z",
  "phenomenonTime": {
    "featureType": "Interval",
    "hasBeginning": { "inXSDDateTimeStamp": "2016-05-04T02:27:02.0Z" },
    "hasEnd": { "inXSDDateTimeStamp": "2016-05-04T03:33:33.0Z" }
  },
   "hasResult": {
    "@context": {
      "resultschema": "http//example.org/resultschema/",
      "a": "resultschema:a",
      "b": {
        "@id": "resultschema:b",
        "@context": {
          "b1": "resultschema:b1",
          "b2": "resultschema:b2"
        }
      }
    },
    "a": -8150858,
    "b": false
  },
  "madeBySensor": "ea est culpa esse"
}